{"fetched_at":"2026-10-18T08:29Z","sources":["SoilGrids 2.0 (ISRIC) properties/query, 0-30 cm depth-weighted means","Open-Meteo elevation API (Copernicus DEM 90 m), 100 m slope stencil"],"fields":{"F0001":{"zone_id":"Z01","lon":-93.50338,"lat":42.06856,"soc_g_kg":19.53,"clay_pct":25.42,"sand_pct":41.93,"ph":6.5,"texture":"loam","elevation_m":null,"slope_pct":null,"aspect":null,"note":"Loam; typical for the zone; elevation lookup failed (RuntimeError)"},"F0002":{"zone_id":"Z02","lon":-93.47681,"lat":42.06862,"soc_g_kg":19.47,"clay_pct":29.83,"sand_pct":36.6,"ph":6.42,"texture":"clay loam","elevation_m":null,"slope_pct":null,"aspect":null,"note":"Clay loam; typical for the zone; elevation lookup failed (RuntimeError)"},"F0003":{"zone_id":"Z01","lon":-93.50743,"lat":42.06704,"soc_g_kg":19.4,"clay_pct":24.63,"sand_pct":42.4,"ph":6.5,"texture":"loam","elevation_m":null,"slope_pct":null,"aspect":null,"note":"Loam; typical for the zone; elevation lookup failed (RuntimeError)"},"F0004":{"zone_id":"Z03","lon":-93.44914,"lat":42.06808,"soc_g_kg":20.2,"clay_pct":33.53,"sand_pct":27.0,"ph":6.5,"texture":"clay loam","elevation_m":null,"slope_pct":null,"aspect":null,"note":"Clay loam; typical for the zone; elevation lookup failed (RuntimeError)"},"F0005":{"zone_id":"Z01","lon":-93.5181,"lat":42.06672,"soc_g_kg":20.72,"clay_pct":24.78,"sand_pct":43.93,"ph":6.5,"texture":"loam","elevation_m":null,"slope_pct":null,"aspect":null,"note":"Loam; typical for the zone; elevation lookup failed (RuntimeError)"},"F0006":{"zone_id":"Z01","lon":-93.51431,"lat":42.06663,"soc_g_kg":20.75,"clay_pct":24.88,"sand_pct":43.35,"ph":6.5,"texture":"loam","elevation_m":null,"slope_pct":null,"aspect":null,"note":"Loam; typical for the zone; elevation lookup failed (RuntimeError)"},"F0007":{"zone_id":"Z01","lon":-93.50971,"lat":42.06599,"soc_g_kg":19.78,"clay_pct":24.58,"sand_pct":42.45,"ph":6.5,"texture":"loam","elevation_m":null,"slope_pct":null,"aspect":null,"note":"Loam; typical for the zone; elevation lookup failed (RuntimeError)"},"F0008":{"zone_id":"Z01","lon":-93.50797,"lat":42.06742,"soc_g_kg":19.4,"clay_pct":24.63,"sand_pct":42.4,"ph":6.5,"texture":"loam","elevation_m":null,"slope_pct":null,"aspect":null,"note":"Loam; typical for the zone; elevation lookup failed (RuntimeError)"},"F0009":{"zone_id":"Z01","lon":-93.49855,"lat":42.06697,"soc_g_kg":20.03,"clay_pct":25.18,"sand_pct":42.08,"ph":6.4,"texture":"loam","elevation_m":null,"slope_pct":null,"aspect":null,"note":"Loam; typical for the zone; elevation lookup failed (RuntimeError)"},"F0010":{"zone_id":"Z01","lon":-93.49474,"lat":42.06654,"soc_g_kg":20.22,"clay_pct":25.08,"sand_pct":43.68,"ph":6.42,"texture":"loam","elevation_m":null,"slope_pct":null,"aspect":null,"note":"Loam; typical for the zone; elevation lookup failed (RuntimeError)"},"F0011":{"zone_id":"Z01","lon":-93.48632,"lat":42.06752,"soc_g_kg":19.97,"clay_pct":24.32,"sand_pct":43.88,"ph":6.5,"texture":"loam","elevation_m":null,"slope_pct":null,"aspect":null,"note":"Loam; typical for the zone; elevation lookup failed (RuntimeError)"},"F0012":{"zone_id":"Z02","lon":-93.47465,"lat":42.06607,"soc_g_kg":19.93,"clay_pct":30.6,"sand_pct":35.9,"ph":6.5,"texture":"clay loam","elevation_m":null,"slope_pct":null,"aspect":null,"note":"Clay loam; typical for the zone; elevation lookup failed (RuntimeError)"},"F0013":{"zone_id":"Z03","lon":-93.422,"lat":42.06604,"soc_g_kg":19.33,"clay_pct":33.3,"sand_pct":33.2,"ph":6.42,"texture":"clay loam","elevation_m":null,"slope_pct":null,"aspect":null,"note":"Clay loam; typical for the zone; elevation lookup failed (RuntimeError)"},"F0014":{"zone_id":"Z03","lon":-93.44857,"lat":42.0663,"soc_g_kg":19.87,"clay_pct":32.32,"sand_pct":28.1,"ph":6.52,"texture":"clay loam","elevation_m":null,"slope_pct":null,"aspect":null,"note":"Clay loam; typical for the zone; elevation lookup failed (RuntimeError)"},"F0015":{"zone_id":"Z02","lon":-93.46624,"lat":42.05931,"soc_g_kg":19.87,"clay_pct":32.7,"sand_pct":30.57,"ph":6.5,"texture":"clay loam","elevation_m":null,"slope_pct":null,"aspect":null,"note":"Clay loam; typical for the zone; elevation lookup failed (RuntimeError)"},"F0016":{"zone_id":"Z01","lon":-93.49225,"lat":42.05934,"soc_g_kg":21.85,"clay_pct":27.75,"sand_pct":40.98,"ph":6.4,"texture":"clay loam","elevation_m":null,"slope_pct":null,"aspect":null,"note":"Clay loam; typical for the zone; elevation lookup failed (RuntimeError)"},"F0017":{"zone_id":"Z02","lon":-93.47208,"lat":42.05844,"soc_g_kg":19.77,"clay_pct":33.3,"sand_pct":30.7,"ph":6.6,"texture":"clay loam","elevation_m":null,"slope_pct":null,"aspect":null,"note":"Clay loam; typical for the zone; elevation lookup failed (RuntimeError)"},"F0018":{"zone_id":"Z01","lon":-93.4972,"lat":42.05664,"soc_g_kg":20.73,"clay_pct":27.4,"sand_pct":40.48,"ph":6.4,"texture":"clay loam","elevation_m":null,"slope_pct":null,"aspect":null,"note":"Clay loam; typical for the zone; elevation lookup failed (RuntimeError)"},"F0019":{"zone_id":"Z01","lon":-93.51102,"lat":42.05522,"soc_g_kg":21.65,"clay_pct":29.75,"sand_pct":39.42,"ph":6.5,"texture":"clay loam","elevation_m":null,"slope_pct":null,"aspect":null,"note":"Clay loam; typical for the zone; elevation lookup failed (RuntimeError)"},"F0020":{"zone_id":"Z02","lon":-93.48032,"lat":42.05714,"soc_g_kg":20.55,"clay_pct":34.62,"sand_pct":30.78,"ph":6.5,"texture":"clay loam","elevation_m":null,"slope_pct":null,"aspect":null,"note":"Clay loam; typical for the zone; elevation lookup failed (RuntimeError)"},"F0021":{"zone_id":"Z02","lon":-93.4707,"lat":42.05561,"soc_g_kg":19.25,"clay_pct":33.78,"sand_pct":28.82,"ph":6.57,"texture":"clay loam","elevation_m":null,"slope_pct":null,"aspect":null,"note":"Clay loam; typical for the zone; elevation lookup failed (RuntimeError)"},"F0022":{"zone_id":"Z02","lon":-93.46691,"lat":42.05503,"soc_g_kg":19.3,"clay_pct":31.37,"sand_pct":34.05,"ph":6.55,"texture":"clay loam","elevation_m":null,"slope_pct":null,"aspect":null,"note":"Clay loam; typical for the zone; elevation lookup failed (RuntimeError)"},"F0023":{"zone_id":"Z01","lon":-93.51823,"lat":42.052,"soc_g_kg":19.15,"clay_pct":25.08,"sand_pct":42.13,"ph":6.4,"texture":"loam","elevation_m":null,"slope_pct":null,"aspect":null,"note":"Loam; typical for the zone; elevation lookup failed (RuntimeError)"},"F0024":{"zone_id":"Z03","lon":-93.43851,"lat":42.05117,"soc_g_kg":21.25,"clay_pct":26.92,"sand_pct":37.93,"ph":6.55,"texture":"loam","elevation_m":null,"slope_pct":null,"aspect":null,"note":"Loam; typical for the zone; elevation lookup failed (RuntimeError)"},"F0025":{"zone_id":"Z03","lon":-93.42216,"lat":42.0518,"soc_g_kg":21.7,"clay_pct":27.22,"sand_pct":40.72,"ph":6.55,"texture":"clay loam","elevation_m":null,"slope_pct":null,"aspect":null,"note":"Clay loam; typical for the zone; elevation lookup failed (RuntimeError)"},"F0026":{"zone_id":"Z01","lon":-93.50955,"lat":42.05245,"soc_g_kg":22.9,"clay_pct":26.08,"sand_pct":41.75,"ph":6.5,"texture":"loam","elevation_m":null,"slope_pct":null,"aspect":null,"note":"Loam; typical for the zone; elevation lookup failed (RuntimeError)"},"F0027":{"zone_id":"Z02","lon":-93.47479,"lat":42.05152,"soc_g_kg":20.05,"clay_pct":25.97,"sand_pct":38.37,"ph":6.55,"texture":"loam","elevation_m":null,"slope_pct":null,"aspect":null,"note":"Loam; typical for the zone; elevation lookup failed (RuntimeError)"},"F0028":{"zone_id":"Z01","lon":-93.50419,"lat":42.05035,"soc_g_kg":22.7,"clay_pct":25.88,"sand_pct":41.33,"ph":6.47,"texture":"loam","elevation_m":null,"slope_pct":null,"aspect":null,"note":"Loam; typical for the zone; elevation lookup failed (RuntimeError)"},"F0029":{"zone_id":"Z02","lon":-93.46552,"lat":42.05014,"soc_g_kg":18.28,"clay_pct":31.7,"sand_pct":35.18,"ph":6.6,"texture":"clay loam","elevation_m":null,"slope_pct":null,"aspect":null,"note":"Clay loam; typical for the zone; elevation lookup failed (RuntimeError)"},"F0030":{"zone_id":"Z01","lon":-93.50766,"lat":42.04798,"soc_g_kg":21.98,"clay_pct":25.92,"sand_pct":42.33,"ph":6.5,"texture":"loam","elevation_m":null,"slope_pct":null,"aspect":null,"note":"Loam; typical for the zone; elevation lookup failed (RuntimeError)"},"F0031":{"zone_id":"Z01","lon":-93.49878,"lat":42.04714,"soc_g_kg":20.48,"clay_pct":25.73,"sand_pct":41.13,"ph":6.4,"texture":"loam","elevation_m":null,"slope_pct":null,"aspect":null,"note":"Loam; typical for the zone; elevation lookup failed (RuntimeError)"},"F0032":{"zone_id":"Z01","lon":-93.51576,"lat":42.04504,"soc_g_kg":18.13,"clay_pct":25.18,"sand_pct":43.73,"ph":6.5,"texture":"loam","elevation_m":null,"slope_pct":null,"aspect":null,"note":"Loam; typical for the zone; elevation lookup failed (RuntimeError)"},"F0033":{"zone_id":"Z02","lon":-93.47496,"lat":42.04846,"soc_g_kg":19.98,"clay_pct":26.1,"sand_pct":39.73,"ph":6.5,"texture":"loam","elevation_m":null,"slope_pct":null,"aspect":null,"note":"Loam; typical for the zone; elevation lookup failed (RuntimeError)"},"F0034":{"zone_id":"Z02","lon":-93.47,"lat":42.04576,"soc_g_kg":19.37,"clay_pct":27.07,"sand_pct":39.27,"ph":6.4,"texture":"clay loam","elevation_m":null,"slope_pct":null,"aspect":null,"note":"Clay loam; typical for the zone; elevation lookup failed (RuntimeError)"},"F0035":{"zone_id":"Z02","lon":-93.45648,"lat":42.04468,"soc_g_kg":19.9,"clay_pct":30.9,"sand_pct":32.92,"ph":6.42,"texture":"clay loam","elevation_m":null,"slope_pct":null,"aspect":null,"note":"Clay loam; typical for the zone; elevation lookup failed (RuntimeError)"},"F0036":{"zone_id":"Z03","lon":-93.4218,"lat":42.04686,"soc_g_kg":21.1,"clay_pct":25.07,"sand_pct":44.18,"ph":6.5,"texture":"loam","elevation_m":null,"slope_pct":null,"aspect":null,"note":"Loam; typical for the zone; elevation lookup failed (RuntimeError)"},"F0037":{"zone_id":"Z01","lon":-93.51314,"lat":42.04372,"soc_g_kg":18.67,"clay_pct":25.73,"sand_pct":44.08,"ph":6.47,"texture":"loam","elevation_m":null,"slope_pct":null,"aspect":null,"note":"Loam; typical for the zone; elevation lookup failed (RuntimeError)"},"F0038":{"zone_id":"Z03","lon":-93.4418